Difficulty,Title,Link,Topics
EASY,N-Repeated Element in Size 2N Array,https://leetcode.com/problems/n-repeated-element-in-size-2n-array,"Array, Hash Table"
EASY,Best Time to Buy and Sell Stock,https://leetcode.com/problems/best-time-to-buy-and-sell-stock,"Array, Dynamic Programming"
EASY,Two Sum,https://leetcode.com/problems/two-sum,"Array, Hash Table"
HARD,Median of Two Sorted Arrays,https://leetcode.com/problems/median-of-two-sorted-arrays,"Array, Binary Search, Divide and Conquer"
MEDIUM,Construct Binary Search Tree from Preorder Traversal,https://leetcode.com/problems/construct-binary-search-tree-from-preorder-traversal,"Array, Stack, Tree, Binary Search Tree, Monotonic Stack, Binary Tree"
EASY,Longest Palindrome,https://leetcode.com/problems/longest-palindrome,"Hash Table, String, Greedy"
MEDIUM,Pairs of Songs With Total Durations Divisible by 60,https://leetcode.com/problems/pairs-of-songs-with-total-durations-divisible-by-60,"Array, Hash Table, Counting"
