Difficulty,Title,Link,Topics
EASY,Number of 1 Bits,https://leetcode.com/problems/number-of-1-bits,"Divide and Conquer, Bit Manipulation"
MEDIUM,Top K Frequent Words,https://leetcode.com/problems/top-k-frequent-words,"Array, Hash Table, String, Trie, Sorting, Heap (Priority Queue), Bucket Sort, Counting"
HARD,Word Ladder,https://leetcode.com/problems/word-ladder,"Hash Table, String, Breadth-First Search"
EASY,Kth Largest Element in a Stream,https://leetcode.com/problems/kth-largest-element-in-a-stream,"Tree, Design, Binary Search Tree, Heap (Priority Queue), Binary Tree, Data Stream"
MEDIUM,Event Emitter,https://leetcode.com/problems/event-emitter,
MEDIUM,Redundant Connection,https://leetcode.com/problems/redundant-connection,"Depth-First Search, Breadth-First Search, Union Find, Graph"
