Difficulty,Title,Link,Topics
MEDIUM,Longest Palindromic Substring,https://leetcode.com/problems/longest-palindromic-substring,"Two Pointers, String, Dynamic Programming"
MEDIUM,Predict the Winner,https://leetcode.com/problems/predict-the-winner,"Array, Math, Dynamic Programming, Recursion, Game Theory"
MEDIUM,House Robber,https://leetcode.com/problems/house-robber,"Array, Dynamic Programming"
EASY,Lucky Numbers in a Matrix,https://leetcode.com/problems/lucky-numbers-in-a-matrix,"Array, Matrix"
MEDIUM,Rotate Image,https://leetcode.com/problems/rotate-image,"Array, Math, Matrix"
MEDIUM,Spiral Matrix,https://leetcode.com/problems/spiral-matrix,"Array, Matrix, Simulation"
EASY,Fizz Buzz,https://leetcode.com/problems/fizz-buzz,"Math, String, Simulation"
MEDIUM,LRU Cache,https://leetcode.com/problems/lru-cache,"Hash Table, Linked List, Design, Doubly-Linked List"
MEDIUM,Snakes and Ladders,https://leetcode.com/problems/snakes-and-ladders,"Array, Breadth-First Search, Matrix"
EASY,Number of Valid Words in a Sentence,https://leetcode.com/problems/number-of-valid-words-in-a-sentence,String
MEDIUM,Find Third Transaction,https://leetcode.com/problems/find-third-transaction,Database
EASY,Maximum Difference Between Increasing Elements,https://leetcode.com/problems/maximum-difference-between-increasing-elements,Array
MEDIUM,Merge Intervals,https://leetcode.com/problems/merge-intervals,"Array, Sorting"
MEDIUM,Maximum Subarray,https://leetcode.com/problems/maximum-subarray,"Array, Divide and Conquer, Dynamic Programming"
MEDIUM,Implement Router,https://leetcode.com/problems/implement-router,"Array, Hash Table, Binary Search, Design, Queue, Ordered Set"
MEDIUM,Find the Largest Area of Square Inside Two Rectangles,https://leetcode.com/problems/find-the-largest-area-of-square-inside-two-rectangles,"Array, Math, Geometry"
HARD,Minimum Cost to Make Array Equal,https://leetcode.com/problems/minimum-cost-to-make-array-equal,"Array, Binary Search, Greedy, Sorting, Prefix Sum"
HARD,Word Search II,https://leetcode.com/problems/word-search-ii,"Array, String, Backtracking, Trie, Matrix"
MEDIUM,Number of Equal Count Substrings,https://leetcode.com/problems/number-of-equal-count-substrings,"Hash Table, String, Sliding Window, Counting"
HARD,Sum of k-Mirror Numbers,https://leetcode.com/problems/sum-of-k-mirror-numbers,"Math, Enumeration"
EASY,Check if Binary String Has at Most One Segment of Ones,https://leetcode.com/problems/check-if-binary-string-has-at-most-one-segment-of-ones,String
HARD,Max Points on a Line,https://leetcode.com/problems/max-points-on-a-line,"Array, Hash Table, Math, Geometry"
EASY,Happy Number,https://leetcode.com/problems/happy-number,"Hash Table, Math, Two Pointers"
MEDIUM,Stone Game,https://leetcode.com/problems/stone-game,"Array, Math, Dynamic Programming, Game Theory"
EASY,Two Sum,https://leetcode.com/problems/two-sum,"Array, Hash Table"
HARD,Cherry Pickup,https://leetcode.com/problems/cherry-pickup,"Array, Dynamic Programming, Matrix"
EASY,Valid Parentheses,https://leetcode.com/problems/valid-parentheses,"String, Stack"
HARD,Trapping Rain Water,https://leetcode.com/problems/trapping-rain-water,"Array, Two Pointers, Dynamic Programming, Stack, Monotonic Stack"
MEDIUM,Longest Substring Without Repeating Characters,https://leetcode.com/problems/longest-substring-without-repeating-characters,"Hash Table, String, Sliding Window"
EASY,Linked List Cycle,https://leetcode.com/problems/linked-list-cycle,"Hash Table, Linked List, Two Pointers"
MEDIUM,Decode String,https://leetcode.com/problems/decode-string,"String, Stack, Recursion"
EASY,Best Time to Buy and Sell Stock,https://leetcode.com/problems/best-time-to-buy-and-sell-stock,"Array, Dynamic Programming"
HARD,Remove Boxes,https://leetcode.com/problems/remove-boxes,"Array, Dynamic Programming, Memoization"
EASY,Merge Sorted Array,https://leetcode.com/problems/merge-sorted-array,"Array, Two Pointers, Sorting"
HARD,Strange Printer,https://leetcode.com/problems/strange-printer,"String, Dynamic Programming"
MEDIUM,Longest Consecutive Sequence,https://leetcode.com/problems/longest-consecutive-sequence,"Array, Hash Table, Union Find"
MEDIUM,Letter Combinations of a Phone Number,https://leetcode.com/problems/letter-combinations-of-a-phone-number,"Hash Table, String, Backtracking"
EASY,Move Zeroes,https://leetcode.com/problems/move-zeroes,"Array, Two Pointers"
MEDIUM,3Sum,https://leetcode.com/problems/3sum,"Array, Two Pointers, Sorting"
EASY,Reverse Linked List,https://leetcode.com/problems/reverse-linked-list,"Linked List, Recursion"
MEDIUM,Number of Islands,https://leetcode.com/problems/number-of-islands,"Array, Depth-First Search, Breadth-First Search, Union Find, Matrix"
MEDIUM,Search a 2D Matrix,https://leetcode.com/problems/search-a-2d-matrix,"Array, Binary Search, Matrix"
MEDIUM,Word Search,https://leetcode.com/problems/word-search,"Array, String, Backtracking, Depth-First Search, Matrix"
MEDIUM,Gas Station,https://leetcode.com/problems/gas-station,"Array, Greedy"
EASY,Remove Duplicates from Sorted Array,https://leetcode.com/problems/remove-duplicates-from-sorted-array,"Array, Two Pointers"
MEDIUM,Meeting Rooms II,https://leetcode.com/problems/meeting-rooms-ii,"Array, Two Pointers, Greedy, Sorting, Heap (Priority Queue), Prefix Sum"
EASY,Valid Palindrome,https://leetcode.com/problems/valid-palindrome,"Two Pointers, String"
MEDIUM,Permutation in String,https://leetcode.com/problems/permutation-in-string,"Hash Table, Two Pointers, String, Sliding Window"
HARD,Merge k Sorted Lists,https://leetcode.com/problems/merge-k-sorted-lists,"Linked List, Divide and Conquer, Heap (Priority Queue), Merge Sort"
MEDIUM,Group Anagrams,https://leetcode.com/problems/group-anagrams,"Array, Hash Table, String, Sorting"
EASY,Single Number,https://leetcode.com/problems/single-number,"Array, Bit Manipulation"
HARD,Find Servers That Handled Most Number of Requests,https://leetcode.com/problems/find-servers-that-handled-most-number-of-requests,"Array, Greedy, Heap (Priority Queue), Ordered Set"
MEDIUM,Insert Delete GetRandom O(1),https://leetcode.com/problems/insert-delete-getrandom-o1,"Array, Hash Table, Math, Design, Randomized"
MEDIUM,Validate IP Address,https://leetcode.com/problems/validate-ip-address,String
MEDIUM,Top K Frequent Elements,https://leetcode.com/problems/top-k-frequent-elements,"Array, Hash Table, Divide and Conquer, Sorting, Heap (Priority Queue), Bucket Sort, Counting, Quickselect"
MEDIUM,Add Two Numbers,https://leetcode.com/problems/add-two-numbers,"Linked List, Math, Recursion"
MEDIUM,Expressive Words,https://leetcode.com/problems/expressive-words,"Array, Two Pointers, String"
MEDIUM,Edit Distance,https://leetcode.com/problems/edit-distance,"String, Dynamic Programming"
MEDIUM,Subarray Sum Equals K,https://leetcode.com/problems/subarray-sum-equals-k,"Array, Hash Table, Prefix Sum"
EASY,Rising Temperature,https://leetcode.com/problems/rising-temperature,Database
EASY,Can Place Flowers,https://leetcode.com/problems/can-place-flowers,"Array, Greedy"
MEDIUM,Kth Smallest Element in a BST,https://leetcode.com/problems/kth-smallest-element-in-a-bst,"Tree, Depth-First Search, Binary Search Tree, Binary Tree"
EASY,Missing Number,https://leetcode.com/problems/missing-number,"Array, Hash Table, Math, Binary Search, Bit Manipulation, Sorting"
MEDIUM,Find Minimum in Rotated Sorted Array,https://leetcode.com/problems/find-minimum-in-rotated-sorted-array,"Array, Binary Search"
MEDIUM,Unique Paths,https://leetcode.com/problems/unique-paths,"Math, Dynamic Programming, Combinatorics"
MEDIUM,Zigzag Conversion,https://leetcode.com/problems/zigzag-conversion,String
MEDIUM,Permutations,https://leetcode.com/problems/permutations,"Array, Backtracking"
HARD,Sliding Window Maximum,https://leetcode.com/problems/sliding-window-maximum,"Array, Queue, Sliding Window, Heap (Priority Queue), Monotonic Queue"
MEDIUM,Compare Version Numbers,https://leetcode.com/problems/compare-version-numbers,"Two Pointers, String"
HARD,Largest Rectangle in Histogram,https://leetcode.com/problems/largest-rectangle-in-histogram,"Array, Stack, Monotonic Stack"
MEDIUM,Longest Palindromic Subsequence,https://leetcode.com/problems/longest-palindromic-subsequence,"String, Dynamic Programming"
MEDIUM,Min Stack,https://leetcode.com/problems/min-stack,"Stack, Design"
MEDIUM,Restore IP Addresses,https://leetcode.com/problems/restore-ip-addresses,"String, Backtracking"
MEDIUM,Reverse Words in a String,https://leetcode.com/problems/reverse-words-in-a-string,"Two Pointers, String"
EASY,Pascal's Triangle,https://leetcode.com/problems/pascals-triangle,"Array, Dynamic Programming"
MEDIUM,Jump Game,https://leetcode.com/problems/jump-game,"Array, Dynamic Programming, Greedy"
HARD,Count of Integers,https://leetcode.com/problems/count-of-integers,"Math, String, Dynamic Programming"
EASY,Climbing Stairs,https://leetcode.com/problems/climbing-stairs,"Math, Dynamic Programming, Memoization"
MEDIUM,Palindromic Substrings,https://leetcode.com/problems/palindromic-substrings,"Two Pointers, String, Dynamic Programming"
MEDIUM,Design Browser History,https://leetcode.com/problems/design-browser-history,"Array, Linked List, Stack, Design, Doubly-Linked List, Data Stream"
EASY,Maximum Product of Two Elements in an Array,https://leetcode.com/problems/maximum-product-of-two-elements-in-an-array,"Array, Sorting, Heap (Priority Queue)"
MEDIUM,Beautiful Arrangement,https://leetcode.com/problems/beautiful-arrangement,"Array, Dynamic Programming, Backtracking, Bit Manipulation, Bitmask"
MEDIUM,Remove K Digits,https://leetcode.com/problems/remove-k-digits,"String, Stack, Greedy, Monotonic Stack"
MEDIUM,Product of Array Except Self,https://leetcode.com/problems/product-of-array-except-self,"Array, Prefix Sum"
EASY,Number of 1 Bits,https://leetcode.com/problems/number-of-1-bits,"Divide and Conquer, Bit Manipulation"
MEDIUM,Unique Paths II,https://leetcode.com/problems/unique-paths-ii,"Array, Dynamic Programming, Matrix"
EASY,Two Sum IV - Input is a BST,https://leetcode.com/problems/two-sum-iv-input-is-a-bst,"Hash Table, Two Pointers, Tree, Depth-First Search, Breadth-First Search, Binary Search Tree, Binary Tree"
