Difficulty,Title,Link,Topics
MEDIUM,Maximum Length of Subarray With Positive Product,https://leetcode.com/problems/maximum-length-of-subarray-with-positive-product,"Array, Dynamic Programming, Greedy"
HARD,Cycle Length Queries in a Tree,https://leetcode.com/problems/cycle-length-queries-in-a-tree,"Array, Tree, Binary Tree"
MEDIUM,Count Collisions on a Road,https://leetcode.com/problems/count-collisions-on-a-road,"String, Stack, Simulation"
MEDIUM,Maximize the Confusion of an Exam,https://leetcode.com/problems/maximize-the-confusion-of-an-exam,"String, Binary Search, Sliding Window, Prefix Sum"
MEDIUM,Number of People Aware of a Secret,https://leetcode.com/problems/number-of-people-aware-of-a-secret,"Dynamic Programming, Queue, Simulation"
HARD,Partition Array Into Two Arrays to Minimize Sum Difference,https://leetcode.com/problems/partition-array-into-two-arrays-to-minimize-sum-difference,"Array, Two Pointers, Binary Search, Dynamic Programming, Bit Manipulation, Ordered Set, Bitmask"
MEDIUM,House Robber,https://leetcode.com/problems/house-robber,"Array, Dynamic Programming"
MEDIUM,Search in Rotated Sorted Array,https://leetcode.com/problems/search-in-rotated-sorted-array,"Array, Binary Search"
MEDIUM,Possible Bipartition,https://leetcode.com/problems/possible-bipartition,"Depth-First Search, Breadth-First Search, Union Find, Graph"
MEDIUM,Stone Game VI,https://leetcode.com/problems/stone-game-vi,"Array, Math, Greedy, Sorting, Heap (Priority Queue), Game Theory"
HARD,Binary Tree Maximum Path Sum,https://leetcode.com/problems/binary-tree-maximum-path-sum,"Dynamic Programming, Tree, Depth-First Search, Binary Tree"
HARD,Find the Count of Monotonic Pairs I,https://leetcode.com/problems/find-the-count-of-monotonic-pairs-i,"Array, Math, Dynamic Programming, Combinatorics, Prefix Sum"
MEDIUM,Next Permutation,https://leetcode.com/problems/next-permutation,"Array, Two Pointers"
HARD,Best Time to Buy and Sell Stock IV,https://leetcode.com/problems/best-time-to-buy-and-sell-stock-iv,"Array, Dynamic Programming"
HARD,Minimum Insertion Steps to Make a String Palindrome,https://leetcode.com/problems/minimum-insertion-steps-to-make-a-string-palindrome,"String, Dynamic Programming"
MEDIUM,Edit Distance,https://leetcode.com/problems/edit-distance,"String, Dynamic Programming"
MEDIUM,Maximum Product Subarray,https://leetcode.com/problems/maximum-product-subarray,"Array, Dynamic Programming"
MEDIUM,Surrounded Regions,https://leetcode.com/problems/surrounded-regions,"Array, Depth-First Search, Breadth-First Search, Union Find, Matrix"
MEDIUM,Sort Colors,https://leetcode.com/problems/sort-colors,"Array, Two Pointers, Sorting"
MEDIUM,"Pow(x, n)",https://leetcode.com/problems/powx-n,"Math, Recursion"
